detailed_industry,soi_industry,business_receipts
Farms,Agricultural production,102607632
"Forestry,_Fishing,_and_Related_Activites",Forestry and logging,9653771
"Forestry,_Fishing,_and_Related_Activites","Support activities and fishing, hunting, and trapping",28444978
Oil_and_Gas_Extraction,Oil and gas extraction,152811669
Mining_(Except_Oil_and_Gas),Coal mining,30461943
Mining_(Except_Oil_and_Gas),Metal ore mining,40435619
Mining_(Except_Oil_and_Gas),Nonmetallic mineral mining and quarrying,22979684
Support_Activities_For_Mining,Support activities for mining,68418785
Electric_Power_Transmission_and_Distribution,"Electric power generation, transmission, and distribution",304106339
Hydroelectric_Power_Generation,"Electric power generation, transmission, and distribution",304106339
Nuclear_Electric_Power_Generation,"Electric power generation, transmission, and distribution",304106339
"Fossil_Fuel_Electric_Power_Generation,_Combustion","Electric power generation, transmission, and distribution",304106339
Other_Electric_Power_Generation,"Electric power generation, transmission, and distribution",304106339
Natural_Gas_Distribution_and_Transmission,Natural gas distribution,71496639
Water_and_Sewer_Systems,"Water, sewage, and other systems",8201254
"Fossil_Fuel_Electric_Power_Generation,_Steam_and_Combined_Cycle",Combination gas and electric,186834583
Construction,Construction,1157122208
"Grain,_Sugar,_and_Vegetable_Oil_Products_Manufacturing","Animal food manufacturing, grain and oilseed milling",117809850
"Grain,_Sugar,_and_Vegetable_Oil_Products_Manufacturing",Sugar and confectionery product,55604824
Other_Food_Products_Manufacturing,"Fruit and vegetable preserving, and specialty food",49006400
Other_Food_Products_Manufacturing,Dairy product,40169945
Other_Food_Products_Manufacturing,Meat and seafood processing,114523892
Other_Food_Products_Manufacturing,Bakeries and tortilla manufacturing,45985669
Other_Food_Products_Manufacturing,Other food,115850113
Beverage_and_Tobacco_Products_Manufacturing,Beverage and tobacco product manufacturing,146654398
"Knitted_Goods,_Carpets,_and_Textile_Finishing_Manufacturing",Textile mills,9726351
Other_Textile_and_Textile_Product_Mills,Textile product mills,19121482
Apparel_Manufacturing,Apparel manufacturing,51184428
Leather_and_Allied_Products_Manufacturing,Leather and allied product manufacturing,6996433
Wood_Product_Manufacturing,Wood product manufacturing,59679713
Paper_Manufacturing,Paper manufacturing,157031263
Printing_and_Related_Support_Activities,Printing and related support activities,73980225
Petroleum_Refining,Petroleum refineries (including integrated),1379953840
Other_Petroleum_and_Coal_Products_Manufacturing,"Asphalt paving, roofing, other petroleum and coal products",13503361
Chemical_Manufacturing,Chemical manufacturing,725534562
Plastics_and_Rubber_Products_Manufacturing,Plastics and rubber products manufacturing,142770333
Other_Nonmetalic_Mineral_Products_Manufacturing,"Clay, refractory, and other nonmetallic mineral product",15052652
Glass_Products_Manufacturing,Glass and glass product,20630264
Cement_Manufacturing,"Cement, concrete, lime and gypsum product",53665699
Primary_Ferrous_Metal_Manufacturing,"Iron, steel mills and steel product",87881164
Primary_Nonferrous_Metal_Manufacturing,Nonferrous metal production and processing,73177511
Primary_Ferrous_Metal_Manufacturing,Foundries,18918407
Primary_Nonferrous_Metal_Manufacturing,Foundries,18918407
Fabricated_Metal_Product_Manufacturing,Fabricated metal product manufacturing,250720364
Machinery_Manufacturing,Machinery manufacturing,313278922
Computer_and_Electronic_Product_Manufacturing,Computer and electronic product manufacturing,574019239
"Electrical_Equipment,_Appliances,_and_Components_Manufacturing","Electrical equipment, appliance, and component manufacturing",224231535
Motor_Vehicle_and_Parts_Manufacturing,Motor vehicles and parts,376153316
Other_Transportation_Equipment_Manufacturing,Aerospace product and parts,288711277
Ships_and_Boats_Manufacturing,Ship and boat building,32907903
Other_Transportation_Equipment_Manufacturing,Other transportation equipment and railroad rolling stock,23588653
Furniture_and_Related_Products_Manufacturing,Furniture and related product manufacturing,49397689
Medical_and_Dental_Supplies_Manufacturing,Medical equipment and supplies,151205981
Other_Miscellaneous_Manufacturing,Other miscellaneous manufacturing,78288618
Wholesale_Durable_Goods,"Merchant wholesalers, durable goods",1446464331
Wholesale_Nondurable_Goods,"Merchant wholesalers, nondurable goods",1909327548
Motor_Vehicle_and_Parts_Dealers,Motor vehicle dealers and parts dealers,594967371
Other_Non_Gas_Stations_Retail,Furniture and home furnishings stores,75329916
Other_Non_Gas_Stations_Retail,Electronics and appliance stores,96122910
Other_Non_Gas_Stations_Retail,Building material and garden equipment and supplies dealers,202675031
Food_and_Beverages_Stores,"Food, beverage and liquor stores",512799814
Other_Non_Gas_Stations_Retail,Health and personal care stores,320840628
Gas_Stations,Gasoline stations,253312956
Other_Non_Gas_Stations_Retail,Clothing and clothing accessories stores,173729565
Other_Non_Gas_Stations_Retail,"Sporting goods, hobby, book, and music stores",80429498
General_Merchandise_Stores,General merchandise stores,614028670
Other_Non_Gas_Stations_Retail,Miscellaneous store retailers,107675079
Other_Non_Gas_Stations_Retail,Nonstore retailers,162886189
Air_Transportation,Air transportation,135314205
Rail_Transportation,Rail transportation,56987789
Water_Transportation,Water transportation,28056599
Truck_Transportation,Truck transportation,192069221
Transit_and_Ground_Passenger_Transportation,Transit and ground passenger transportation,22001880
Pipeline_Transportation,Pipeline transportation,10810058
Other_Transportation_and_Support_Activities,Other transportation and support activities,190534107
Warehousing_and_Storage,Warehousing and storage,20199130
Publishing_Industries_(Except_Internet),Publishing industries (except Internet),220057900
Movie_Theaters,Motion picture and video industries (except video rental),69650327
Other_Motion_Picture_and_Sound_Recording,Motion picture and video industries (except video rental),69650327
Other_Motion_Picture_and_Sound_Recording,Sound recording industries,6031740
Broadcasting_(Except_Internet)_and_Telecommunications,Broadcasting (except Internet),88908660
Telephone_Communication,"Telecommunications (including paging, cellular, satellite, cable and Internet service providers)",455878368
Cable_Television,"Telecommunications (including paging, cellular, satellite, cable and Internet service providers)",455878368
Other_Telecommunication,"Telecommunications (including paging, cellular, satellite, cable and Internet service providers)",455878368
Information_and_Data_Processing,"Data Processing, Hosting, and Related Services",26900369
Information_and_Data_Processing,Other information services,56800905
Depository_Credit_Intermediation,Depository credit intermediation,18357397
Nondepository_Credit_Intermediation,Credit card issuing and other consumer credit,55113484
Nondepository_Credit_Intermediation,Real estate credit (including mortgage bankers and originators),10456599
Nondepository_Credit_Intermediation,"International, secondary financing, and other nondepository credit intermediation",6839348
Other_Intermediation,"Activities related to credit intermediation (loan brokers, check clearing, etc.)",41119581
"Securities,_Commodity_Contracts,_and_Other_Financial_Investments_and_Related_Activities","Securities, commodity contracts, other financial investments and related activities",198791696
Insurance_Carriers,Life insurance,783307172
Insurance_Carriers,Mutual property and casualty companies (Form 1120-PC),211511871
Insurance_Carriers,Stock property and casualty companies (Form 1120-PC),607840243
Insurance_Agencies_and_Brokers_and_Related_Services,Insurance agencies and brokerages,65855536
Insurance_Agencies_and_Brokers_and_Related_Services,"Other insurance related activities (including third-party admin. of Ins., etc.)",47817599
"Funds,_Trusts,_and_Other_Financial_Vehicles_","Funds, trusts, and other financial vehicles",1446581
Real_Estate,Real estate,110331976
Rental_and_Leasing_(Including_Nonfinancial_Intangibles),Rental and leasing services,94322307
Legal_Services,Legal services,92305297
"Other_Professional,_Scientific,_and_Technical_Services","Accounting, tax preparation, bookkeeping, and payroll services",98225121
"Other_Professional,_Scientific,_and_Technical_Services","Architectural, engineering, and related services",211916650
"Other_Professional,_Scientific,_and_Technical_Services",Specialized design services,16404799
Computer_Systems_Design_and_Related_Services,Computer systems design and related services,220809159
"Other_Professional,_Scientific,_and_Technical_Services","Management, scientific, and technical consulting services",185202316
"Other_Professional,_Scientific,_and_Technical_Services",Scientific research and development services,37850956
"Other_Professional,_Scientific,_and_Technical_Services",Advertising and related services,78172755
"Other_Professional,_Scientific,_and_Technical_Services","Other professional, scientific, and technical services",85830903
Management_Of_Companies_and_Enterprises,Management of companies (holding companies),215313771
Administrative_and_Support_Services,Administrative and support services,364730218
Waste_Management_and_Remediation_Services,Waste management and remediation services,64892164
Educational_Services,Educational services,55914157
Ambulatory_Health_Care_Services,Offices of health practitioners and outpatient care centers,414884306
Social_Assistance,Miscellaneous health care and social assistance,101613667
Hospitals,"Hospitals, nursing, and residential care facilities",125166953
Nursing_and_Residential_Care_Facilities,"Hospitals, nursing, and residential care facilities",125166953
"Independent_Artists,_Writers,_and_Performers","Other arts, entertainment, and recreation",41873868
"Other_Performing_Arts,_Spectator_Sports,_Museums,_and_Related_Activities","Other arts, entertainment, and recreation",41873868
Amusement_Parks,"Amusement, gambling, and recreation industries",45180658
Gambling_and_Bowling,"Amusement, gambling, and recreation industries",45180658
Other_Recreation_Services,"Amusement, gambling, and recreation industries",45180658
Accomodation,Accommodation,78250277
Food_Services_and_Drinking_Places,Food services and drinking places,334650023
Other_Services_(Except_Public_Administration),Other services,183044761
